{
  "$schema": "https://json-schema.org/draft/2020-12/schema",
  "$id": "https://igsl.dev/icsl/schemas/0.1-freeze/GovernedContext.schema.json",
  "title": "GovernedContext",
  "type": "object",
  "properties": {
    "kind": { "const": "GovernedContext" },
    "governed_context_id": { "type": "string" },
    "protocol_version_id": {
      "type": "string",
      "description": "The pinned ProtocolVersion. In v0.1 a GovernedContext MUST NOT be evaluated against any other ProtocolVersion."
    },
    "protocol_version_hash": {
      "$ref": "ICSLCommon.schema.json#/$defs/TaggedHash",
      "description": "REQUIRED: sha256 over the RFC 8785 (JCS) canonical bytes of the complete pinned ProtocolVersion object (the ProtocolVersion contains no hash of itself, so the preimage is non-self-referential). Pins the exact protocol-version content, not just its id."
    },
    "current_time": {
      "type": "string",
      "format": "date-time",
      "description": "Required for any evaluation involving deadlines, durations, or lapse (CURRENT_TIME_REQUIRED)."
    },
    "subject_ref": { "type": "string" },
    "state": { "type": "object" }
  },
  "required": ["kind", "governed_context_id", "protocol_version_id", "protocol_version_hash"],
  "additionalProperties": true
}
